{
    "$schema": "http://json-schema.org/draft-06/schema#",
    "$ref": "#/definitions/AthleteContractsListSchema",
    "definitions": {
        "AthleteContractsListSchema": {
            "type": "object",
            "additionalProperties": false,
            "properties": {
                "count": {
                    "type": "integer"
                },
                "pageIndex": {
                    "type": "integer"
                },
                "pageSize": {
                    "type": "integer"
                },
                "pageCount": {
                    "type": "integer"
                },
                "items": {
                    "type": "array",
                    "items": {
                        "$ref": "#/definitions/Item"
                    }
                }
            },
            "required": [
                "count",
                "items",
                "pageCount",
                "pageIndex",
                "pageSize"
            ],
            "title": "AthleteContractsListSchema"
        },
        "Item": {
            "type": "object",
            "additionalProperties": false,
            "properties": {
                "$ref": {
                    "type": "string",
                    "format": "uri",
                    "qt-uri-protocols": [
                        "http"
                    ]
                }
            },
            "required": [
                "$ref"
            ],
            "title": "Item"
        }
    }
}
