{
  "count": 35,
  "pageIndex": 1,
  "pageSize": 25,
  "pageCount": 2,
  "items": [
    {
      "$ref": "http://sports.core.api.espn.com/v2/sports/soccer/leagues/eng.1/seasons/2024/athletes/138398?lang=en&region=us"
    },
    {
      "$ref": "http://sports.core.api.espn.com/v2/sports/soccer/leagues/eng.1/seasons/2024/athletes/196176?lang=en&region=us"
    },
    {
      "$ref": "http://sports.core.api.espn.com/v2/sports/soccer/leagues/eng.1/seasons/2024/athletes/341729?lang=en&region=us"
    },
    {
      "$ref": "http://sports.core.api.espn.com/v2/sports/soccer/leagues/eng.1/seasons/2024/athletes/343573?lang=en&region=us"
    },
    {
      "$ref": "http://sports.core.api.espn.com/v2/sports/soccer/leagues/eng.1/seasons/2024/athletes/390095?lang=en&region=us"
    },
    {
      "$ref": "http://sports.core.api.espn.com/v2/sports/soccer/leagues/eng.1/seasons/2024/athletes/214794?lang=en&region=us"
    },
    {
      "$ref": "http://sports.core.api.espn.com/v2/sports/soccer/leagues/eng.1/seasons/2024/athletes/217482?lang=en&region=us"
    },
    {
      "$ref": "http://sports.core.api.espn.com/v2/sports/soccer/leagues/eng.1/seasons/2024/athletes/236322?lang=en&region=us"
    },
    {
      "$ref": "http://sports.core.api.espn.com/v2/sports/soccer/leagues/eng.1/seasons/2024/athletes/238004?lang=en&region=us"
    },
    {
      "$ref": "http://sports.core.api.espn.com/v2/sports/soccer/leagues/eng.1/seasons/2024/athletes/241077?lang=en&region=us"
    },
    {
      "$ref": "http://sports.core.api.espn.com/v2/sports/soccer/leagues/eng.1/seasons/2024/athletes/277385?lang=en&region=us"
    },
    {
      "$ref": "http://sports.core.api.espn.com/v2/sports/soccer/leagues/eng.1/seasons/2024/athletes/282716?lang=en&region=us"
    },
    {
      "$ref": "http://sports.core.api.espn.com/v2/sports/soccer/leagues/eng.1/seasons/2024/athletes/298329?lang=en&region=us"
    },
    {
      "$ref": "http://sports.core.api.espn.com/v2/sports/soccer/leagues/eng.1/seasons/2024/athletes/304965?lang=en&region=us"
    },
    {
      "$ref": "http://sports.core.api.espn.com/v2/sports/soccer/leagues/eng.1/seasons/2024/athletes/351059?lang=en&region=us"
    },
    {
      "$ref": "http://sports.core.api.espn.com/v2/sports/soccer/leagues/eng.1/seasons/2024/athletes/358436?lang=en&region=us"
    },
    {
      "$ref": "http://sports.core.api.espn.com/v2/sports/soccer/leagues/eng.1/seasons/2024/athletes/392659?lang=en&region=us"
    },
    {
      "$ref": "http://sports.core.api.espn.com/v2/sports/soccer/leagues/eng.1/seasons/2024/athletes/88274?lang=en&region=us"
    },
    {
      "$ref": "http://sports.core.api.espn.com/v2/sports/soccer/leagues/eng.1/seasons/2024/athletes/165778?lang=en&region=us"
    },
    {
      "$ref": "http://sports.core.api.espn.com/v2/sports/soccer/leagues/eng.1/seasons/2024/athletes/189972?lang=en&region=us"
    },
    {
      "$ref": "http://sports.core.api.espn.com/v2/sports/soccer/leagues/eng.1/seasons/2024/athletes/203669?lang=en&region=us"
    },
    {
      "$ref": "http://sports.core.api.espn.com/v2/sports/soccer/leagues/eng.1/seasons/2024/athletes/209581?lang=en&region=us"
    },
    {
      "$ref": "http://sports.core.api.espn.com/v2/sports/soccer/leagues/eng.1/seasons/2024/athletes/238262?lang=en&region=us"
    },
    {
      "$ref": "http://sports.core.api.espn.com/v2/sports/soccer/leagues/eng.1/seasons/2024/athletes/307172?lang=en&region=us"
    },
    {
      "$ref": "http://sports.core.api.espn.com/v2/sports/soccer/leagues/eng.1/seasons/2024/athletes/349733?lang=en&region=us"
    }
  ]
}