{
  "count": 104,
  "pageIndex": 1,
  "pageSize": 25,
  "pageCount": 5,
  "items": [
    {
      "$ref": "http://sports.core.api.espn.com/v2/sports/football/leagues/nfl/seasons/2025?lang=en&region=us"
    },
    {
      "$ref": "http://sports.core.api.espn.com/v2/sports/football/leagues/nfl/seasons/2024?lang=en&region=us"
    },
    {
      "$ref": "http://sports.core.api.espn.com/v2/sports/football/leagues/nfl/seasons/2023?lang=en&region=us"
    },
    {
      "$ref": "http://sports.core.api.espn.com/v2/sports/football/leagues/nfl/seasons/2022?lang=en&region=us"
    },
    {
      "$ref": "http://sports.core.api.espn.com/v2/sports/football/leagues/nfl/seasons/2021?lang=en&region=us"
    },
    {
      "$ref": "http://sports.core.api.espn.com/v2/sports/football/leagues/nfl/seasons/2020?lang=en&region=us"
    },
    {
      "$ref": "http://sports.core.api.espn.com/v2/sports/football/leagues/nfl/seasons/2019?lang=en&region=us"
    },
    {
      "$ref": "http://sports.core.api.espn.com/v2/sports/football/leagues/nfl/seasons/2018?lang=en&region=us"
    },
    {
      "$ref": "http://sports.core.api.espn.com/v2/sports/football/leagues/nfl/seasons/2017?lang=en&region=us"
    },
    {
      "$ref": "http://sports.core.api.espn.com/v2/sports/football/leagues/nfl/seasons/2016?lang=en&region=us"
    },
    {
      "$ref": "http://sports.core.api.espn.com/v2/sports/football/leagues/nfl/seasons/2015?lang=en&region=us"
    },
    {
      "$ref": "http://sports.core.api.espn.com/v2/sports/football/leagues/nfl/seasons/2014?lang=en&region=us"
    },
    {
      "$ref": "http://sports.core.api.espn.com/v2/sports/football/leagues/nfl/seasons/2013?lang=en&region=us"
    },
    {
      "$ref": "http://sports.core.api.espn.com/v2/sports/football/leagues/nfl/seasons/2012?lang=en&region=us"
    },
    {
      "$ref": "http://sports.core.api.espn.com/v2/sports/football/leagues/nfl/seasons/2011?lang=en&region=us"
    },
    {
      "$ref": "http://sports.core.api.espn.com/v2/sports/football/leagues/nfl/seasons/2010?lang=en&region=us"
    },
    {
      "$ref": "http://sports.core.api.espn.com/v2/sports/football/leagues/nfl/seasons/2009?lang=en&region=us"
    },
    {
      "$ref": "http://sports.core.api.espn.com/v2/sports/football/leagues/nfl/seasons/2008?lang=en&region=us"
    },
    {
      "$ref": "http://sports.core.api.espn.com/v2/sports/football/leagues/nfl/seasons/2007?lang=en&region=us"
    },
    {
      "$ref": "http://sports.core.api.espn.com/v2/sports/football/leagues/nfl/seasons/2006?lang=en&region=us"
    },
    {
      "$ref": "http://sports.core.api.espn.com/v2/sports/football/leagues/nfl/seasons/2005?lang=en&region=us"
    },
    {
      "$ref": "http://sports.core.api.espn.com/v2/sports/football/leagues/nfl/seasons/2004?lang=en&region=us"
    },
    {
      "$ref": "http://sports.core.api.espn.com/v2/sports/football/leagues/nfl/seasons/2003?lang=en&region=us"
    },
    {
      "$ref": "http://sports.core.api.espn.com/v2/sports/football/leagues/nfl/seasons/2002?lang=en&region=us"
    },
    {
      "$ref": "http://sports.core.api.espn.com/v2/sports/football/leagues/nfl/seasons/2001?lang=en&region=us"
    }
  ]
}