{
  "count": 272,
  "pageIndex": 1,
  "pageSize": 25,
  "pageCount": 11,
  "items": [
    {
      "$ref": "http://sports.core.api.espn.com/v2/sports/football/leagues/nfl/events/401772510?lang=en&region=us"
    },
    {
      "$ref": "http://sports.core.api.espn.com/v2/sports/football/leagues/nfl/events/401772714?lang=en&region=us"
    },
    {
      "$ref": "http://sports.core.api.espn.com/v2/sports/football/leagues/nfl/events/401772830?lang=en&region=us"
    },
    {
      "$ref": "http://sports.core.api.espn.com/v2/sports/football/leagues/nfl/events/401772829?lang=en&region=us"
    },
    {
      "$ref": "http://sports.core.api.espn.com/v2/sports/football/leagues/nfl/events/401772719?lang=en&region=us"
    },
    {
      "$ref": "http://sports.core.api.espn.com/v2/sports/football/leagues/nfl/events/401772720?lang=en&region=us"
    },
    {
      "$ref": "http://sports.core.api.espn.com/v2/sports/football/leagues/nfl/events/401772718?lang=en&region=us"
    },
    {
      "$ref": "http://sports.core.api.espn.com/v2/sports/football/leagues/nfl/events/401772721?lang=en&region=us"
    },
    {
      "$ref": "http://sports.core.api.espn.com/v2/sports/football/leagues/nfl/events/401772827?lang=en&region=us"
    },
    {
      "$ref": "http://sports.core.api.espn.com/v2/sports/football/leagues/nfl/events/401772828?lang=en&region=us"
    },
    {
      "$ref": "http://sports.core.api.espn.com/v2/sports/football/leagues/nfl/events/401772832?lang=en&region=us"
    },
    {
      "$ref": "http://sports.core.api.espn.com/v2/sports/football/leagues/nfl/events/401772831?lang=en&region=us"
    },
    {
      "$ref": "http://sports.core.api.espn.com/v2/sports/football/leagues/nfl/events/401772722?lang=en&region=us"
    },
    {
      "$ref": "http://sports.core.api.espn.com/v2/sports/football/leagues/nfl/events/401772723?lang=en&region=us"
    },
    {
      "$ref": "http://sports.core.api.espn.com/v2/sports/football/leagues/nfl/events/401772918?lang=en&region=us"
    },
    {
      "$ref": "http://sports.core.api.espn.com/v2/sports/football/leagues/nfl/events/401772810?lang=en&region=us"
    },
    {
      "$ref": "http://sports.core.api.espn.com/v2/sports/football/leagues/nfl/events/401772936?lang=en&region=us"
    },
    {
      "$ref": "http://sports.core.api.espn.com/v2/sports/football/leagues/nfl/events/401772725?lang=en&region=us"
    },
    {
      "$ref": "http://sports.core.api.espn.com/v2/sports/football/leagues/nfl/events/401772834?lang=en&region=us"
    },
    {
      "$ref": "http://sports.core.api.espn.com/v2/sports/football/leagues/nfl/events/401772835?lang=en&region=us"
    },
    {
      "$ref": "http://sports.core.api.espn.com/v2/sports/football/leagues/nfl/events/401772724?lang=en&region=us"
    },
    {
      "$ref": "http://sports.core.api.espn.com/v2/sports/football/leagues/nfl/events/401772728?lang=en&region=us"
    },
    {
      "$ref": "http://sports.core.api.espn.com/v2/sports/football/leagues/nfl/events/401772833?lang=en&region=us"
    },
    {
      "$ref": "http://sports.core.api.espn.com/v2/sports/football/leagues/nfl/events/401772727?lang=en&region=us"
    },
    {
      "$ref": "http://sports.core.api.espn.com/v2/sports/football/leagues/nfl/events/401772836?lang=en&region=us"
    }
  ]
}