{
  "count": 23,
  "pageIndex": 1,
  "pageSize": 10,
  "pageCount": 3,
  "items": [
    {
      "$ref": "http://sports.core.api.espn.com/v2/sports/baseball/leagues/mlb/positions/0?lang=en&region=us"
    },
    {
      "$ref": "http://sports.core.api.espn.com/v2/sports/baseball/leagues/mlb/positions/1?lang=en&region=us"
    },
    {
      "$ref": "http://sports.core.api.espn.com/v2/sports/baseball/leagues/mlb/positions/2?lang=en&region=us"
    },
    {
      "$ref": "http://sports.core.api.espn.com/v2/sports/baseball/leagues/mlb/positions/3?lang=en&region=us"
    },
    {
      "$ref": "http://sports.core.api.espn.com/v2/sports/baseball/leagues/mlb/positions/4?lang=en&region=us"
    },
    {
      "$ref": "http://sports.core.api.espn.com/v2/sports/baseball/leagues/mlb/positions/5?lang=en&region=us"
    },
    {
      "$ref": "http://sports.core.api.espn.com/v2/sports/baseball/leagues/mlb/positions/6?lang=en&region=us"
    },
    {
      "$ref": "http://sports.core.api.espn.com/v2/sports/baseball/leagues/mlb/positions/7?lang=en&region=us"
    },
    {
      "$ref": "http://sports.core.api.espn.com/v2/sports/baseball/leagues/mlb/positions/8?lang=en&region=us"
    },
    {
      "$ref": "http://sports.core.api.espn.com/v2/sports/baseball/leagues/mlb/positions/9?lang=en&region=us"
    }
  ]
}