{"count":2,"pageIndex":1,"pageSize":25,"pageCount":1,"items":[{"$ref":"http://sports.core.api.espn.com/v2/sports/football/leagues/college-football/seasons/2025/types/2/groups/80?lang=en&region=us"},{"$ref":"http://sports.core.api.espn.com/v2/sports/football/leagues/college-football/seasons/2025/types/2/groups/81?lang=en&region=us"}]}