{
  "count": 28,
  "pageIndex": 1,
  "pageSize": 10,
  "pageCount": 3,
  "items": [
    {
      "$ref": "http://sports.core.api.espn.com/v2/sports/hockey/leagues/nhl/positions/1?lang=en&region=us"
    },
    {
      "$ref": "http://sports.core.api.espn.com/v2/sports/hockey/leagues/nhl/positions/2?lang=en&region=us"
    },
    {
      "$ref": "http://sports.core.api.espn.com/v2/sports/hockey/leagues/nhl/positions/3?lang=en&region=us"
    },
    {
      "$ref": "http://sports.core.api.espn.com/v2/sports/hockey/leagues/nhl/positions/4?lang=en&region=us"
    },
    {
      "$ref": "http://sports.core.api.espn.com/v2/sports/hockey/leagues/nhl/positions/5?lang=en&region=us"
    },
    {
      "$ref": "http://sports.core.api.espn.com/v2/sports/hockey/leagues/nhl/positions/8?lang=en&region=us"
    },
    {
      "$ref": "http://sports.core.api.espn.com/v2/sports/hockey/leagues/nhl/positions/9?lang=en&region=us"
    },
    {
      "$ref": "http://sports.core.api.espn.com/v2/sports/hockey/leagues/nhl/positions/11?lang=en&region=us"
    },
    {
      "$ref": "http://sports.core.api.espn.com/v2/sports/hockey/leagues/nhl/positions/12?lang=en&region=us"
    },
    {
      "$ref": "http://sports.core.api.espn.com/v2/sports/hockey/leagues/nhl/positions/13?lang=en&region=us"
    }
  ]
}