{
  "count": 42,
  "pageIndex": 1,
  "pageSize": 10,
  "pageCount": 5,
  "items": [
    {
      "$ref": "http://sports.core.api.espn.com/v2/sports/soccer/leagues/uefa.champions/positions/1?lang=en&region=us"
    },
    {
      "$ref": "http://sports.core.api.espn.com/v2/sports/soccer/leagues/uefa.champions/positions/2?lang=en&region=us"
    },
    {
      "$ref": "http://sports.core.api.espn.com/v2/sports/soccer/leagues/uefa.champions/positions/3?lang=en&region=us"
    },
    {
      "$ref": "http://sports.core.api.espn.com/v2/sports/soccer/leagues/uefa.champions/positions/4?lang=en&region=us"
    },
    {
      "$ref": "http://sports.core.api.espn.com/v2/sports/soccer/leagues/uefa.champions/positions/5?lang=en&region=us"
    },
    {
      "$ref": "http://sports.core.api.espn.com/v2/sports/soccer/leagues/uefa.champions/positions/6?lang=en&region=us"
    },
    {
      "$ref": "http://sports.core.api.espn.com/v2/sports/soccer/leagues/uefa.champions/positions/7?lang=en&region=us"
    },
    {
      "$ref": "http://sports.core.api.espn.com/v2/sports/soccer/leagues/uefa.champions/positions/8?lang=en&region=us"
    },
    {
      "$ref": "http://sports.core.api.espn.com/v2/sports/soccer/leagues/uefa.champions/positions/9?lang=en&region=us"
    },
    {
      "$ref": "http://sports.core.api.espn.com/v2/sports/soccer/leagues/uefa.champions/positions/10?lang=en&region=us"
    }
  ]
}