{
  "count": 3,
  "pageIndex": 1,
  "pageSize": 25,
  "pageCount": 1,
  "items": [
    {
      "$ref": "http://sports.core.api.espn.com/v2/sports/basketball/leagues/nba/athletes/5104157/contracts/2026?lang=en&region=us"
    },
    {
      "$ref": "http://sports.core.api.espn.com/v2/sports/basketball/leagues/nba/athletes/5104157/contracts/2025?lang=en&region=us"
    },
    {
      "$ref": "http://sports.core.api.espn.com/v2/sports/basketball/leagues/nba/athletes/5104157/contracts/2024?lang=en&region=us"
    }
  ]
}