{
  "count": 11,
  "pageIndex": 1,
  "pageSize": 10,
  "pageCount": 2,
  "items": [
    {
      "$ref": "http://sports.core.api.espn.com/v2/sports/basketball/leagues/nba/positions/0?lang=en&region=us"
    },
    {
      "$ref": "http://sports.core.api.espn.com/v2/sports/basketball/leagues/nba/positions/1?lang=en&region=us"
    },
    {
      "$ref": "http://sports.core.api.espn.com/v2/sports/basketball/leagues/nba/positions/2?lang=en&region=us"
    },
    {
      "$ref": "http://sports.core.api.espn.com/v2/sports/basketball/leagues/nba/positions/3?lang=en&region=us"
    },
    {
      "$ref": "http://sports.core.api.espn.com/v2/sports/basketball/leagues/nba/positions/4?lang=en&region=us"
    },
    {
      "$ref": "http://sports.core.api.espn.com/v2/sports/basketball/leagues/nba/positions/5?lang=en&region=us"
    },
    {
      "$ref": "http://sports.core.api.espn.com/v2/sports/basketball/leagues/nba/positions/6?lang=en&region=us"
    },
    {
      "$ref": "http://sports.core.api.espn.com/v2/sports/basketball/leagues/nba/positions/7?lang=en&region=us"
    },
    {
      "$ref": "http://sports.core.api.espn.com/v2/sports/basketball/leagues/nba/positions/8?lang=en&region=us"
    },
    {
      "$ref": "http://sports.core.api.espn.com/v2/sports/basketball/leagues/nba/positions/9?lang=en&region=us"
    }
  ]
}