{"count":71,"pageIndex":1,"pageSize":25,"pageCount":3,"items":[{"$ref":"http://sports.core.api.espn.com/v2/sports/football/leagues/nfl/providers/0?lang=en&region=us"},{"$ref":"http://sports.core.api.espn.com/v2/sports/football/leagues/nfl/providers/1?lang=en&region=us"},{"$ref":"http://sports.core.api.espn.com/v2/sports/football/leagues/nfl/providers/2?lang=en&region=us"},{"$ref":"http://sports.core.api.espn.com/v2/sports/football/leagues/nfl/providers/3?lang=en&region=us"},{"$ref":"http://sports.core.api.espn.com/v2/sports/football/leagues/nfl/providers/4?lang=en&region=us"},{"$ref":"http://sports.core.api.espn.com/v2/sports/football/leagues/nfl/providers/5?lang=en&region=us"},{"$ref":"http://sports.core.api.espn.com/v2/sports/football/leagues/nfl/providers/6?lang=en&region=us"},{"$ref":"http://sports.core.api.espn.com/v2/sports/football/leagues/nfl/providers/7?lang=en&region=us"},{"$ref":"http://sports.core.api.espn.com/v2/sports/football/leagues/nfl/providers/8?lang=en&region=us"},{"$ref":"http://sports.core.api.espn.com/v2/sports/football/leagues/nfl/providers/9?lang=en&region=us"},{"$ref":"http://sports.core.api.espn.com/v2/sports/football/leagues/nfl/providers/10?lang=en&region=us"},{"$ref":"http://sports.core.api.espn.com/v2/sports/football/leagues/nfl/providers/11?lang=en&region=us"},{"$ref":"http://sports.core.api.espn.com/v2/sports/football/leagues/nfl/providers/12?lang=en&region=us"},{"$ref":"http://sports.core.api.espn.com/v2/sports/football/leagues/nfl/providers/13?lang=en&region=us"},{"$ref":"http://sports.core.api.espn.com/v2/sports/football/leagues/nfl/providers/14?lang=en&region=us"},{"$ref":"http://sports.core.api.espn.com/v2/sports/football/leagues/nfl/providers/15?lang=en&region=us"},{"$ref":"http://sports.core.api.espn.com/v2/sports/football/leagues/nfl/providers/16?lang=en&region=us"},{"$ref":"http://sports.core.api.espn.com/v2/sports/football/leagues/nfl/providers/17?lang=en&region=us"},{"$ref":"http://sports.core.api.espn.com/v2/sports/football/leagues/nfl/providers/18?lang=en&region=us"},{"$ref":"http://sports.core.api.espn.com/v2/sports/football/leagues/nfl/providers/19?lang=en&region=us"},{"$ref":"http://sports.core.api.espn.com/v2/sports/football/leagues/nfl/providers/20?lang=en&region=us"},{"$ref":"http://sports.core.api.espn.com/v2/sports/football/leagues/nfl/providers/21?lang=en&region=us"},{"$ref":"http://sports.core.api.espn.com/v2/sports/football/leagues/nfl/providers/22?lang=en&region=us"},{"$ref":"http://sports.core.api.espn.com/v2/sports/football/leagues/nfl/providers/23?lang=en&region=us"},{"$ref":"http://sports.core.api.espn.com/v2/sports/football/leagues/nfl/providers/24?lang=en&region=us"}]}