{
  "count": 4,
  "pageIndex": 1,
  "pageSize": 25,
  "pageCount": 1,
  "items": [
    {
      "$ref": "http://sports.core.api.espn.com/v2/sports/football/leagues/nfl/calendar/ondays?lang=en&region=us"
    },
    {
      "$ref": "http://sports.core.api.espn.com/v2/sports/football/leagues/nfl/calendar/offdays?lang=en&region=us"
    },
    {
      "$ref": "http://sports.core.api.espn.com/v2/sports/football/leagues/nfl/calendar/blacklist?lang=en&region=us"
    },
    {
      "$ref": "http://sports.core.api.espn.com/v2/sports/football/leagues/nfl/calendar/whitelist?lang=en&region=us"
    }
  ]
}