{
  "count": 13,
  "pageIndex": 1,
  "pageSize": 100,
  "pageCount": 1,
  "items": [
    {
      "$ref": "http://sports.core.api.espn.com/v2/sports/baseball/leagues/mlb/seasons/2025/athletes/4722960/injuries/-153169?lang=en&region=us"
    },
    {
      "$ref": "http://sports.core.api.espn.com/v2/sports/baseball/leagues/mlb/seasons/2025/athletes/4917640/injuries/966375?lang=en&region=us"
    },
    {
      "$ref": "http://sports.core.api.espn.com/v2/sports/baseball/leagues/mlb/seasons/2025/athletes/5271396/injuries/966302?lang=en&region=us"
    },
    {
      "$ref": "http://sports.core.api.espn.com/v2/sports/baseball/leagues/mlb/seasons/2025/athletes/40981/injuries/-152264?lang=en&region=us"
    },
    {
      "$ref": "http://sports.core.api.espn.com/v2/sports/baseball/leagues/mlb/seasons/2025/athletes/40346/injuries/965649?lang=en&region=us"
    },
    {
      "$ref": "http://sports.core.api.espn.com/v2/sports/baseball/leagues/mlb/seasons/2025/athletes/37820/injuries/-148962?lang=en&region=us"
    },
    {
      "$ref": "http://sports.core.api.espn.com/v2/sports/baseball/leagues/mlb/seasons/2025/athletes/5133834/injuries/958633?lang=en&region=us"
    },
    {
      "$ref": "http://sports.core.api.espn.com/v2/sports/baseball/leagues/mlb/seasons/2025/athletes/5150962/injuries/-145272?lang=en&region=us"
    },
    {
      "$ref": "http://sports.core.api.espn.com/v2/sports/baseball/leagues/mlb/seasons/2025/athletes/33860/injuries/955861?lang=en&region=us"
    },
    {
      "$ref": "http://sports.core.api.espn.com/v2/sports/baseball/leagues/mlb/seasons/2025/athletes/5080750/injuries/-144181?lang=en&region=us"
    },
    {
      "$ref": "http://sports.core.api.espn.com/v2/sports/baseball/leagues/mlb/seasons/2025/athletes/31117/injuries/-143748?lang=en&region=us"
    },
    {
      "$ref": "http://sports.core.api.espn.com/v2/sports/baseball/leagues/mlb/seasons/2025/athletes/33760/injuries/-143724?lang=en&region=us"
    },
    {
      "$ref": "http://sports.core.api.espn.com/v2/sports/baseball/leagues/mlb/seasons/2025/athletes/5120814/injuries/-143065?lang=en&region=us"
    }
  ]
}