{
  "count": 6,
  "pageIndex": 1,
  "pageSize": 25,
  "pageCount": 1,
  "items": [
    {
      "$ref": "http://sports.core.api.espn.com/v2/sports/basketball/leagues/nba/events/401705426?lang=en&region=us"
    },
    {
      "$ref": "http://sports.core.api.espn.com/v2/sports/basketball/leagues/nba/events/401705427?lang=en&region=us"
    },
    {
      "$ref": "http://sports.core.api.espn.com/v2/sports/basketball/leagues/nba/events/401705428?lang=en&region=us"
    },
    {
      "$ref": "http://sports.core.api.espn.com/v2/sports/basketball/leagues/nba/events/401705429?lang=en&region=us"
    },
    {
      "$ref": "http://sports.core.api.espn.com/v2/sports/basketball/leagues/nba/events/401705430?lang=en&region=us"
    },
    {
      "$ref": "http://sports.core.api.espn.com/v2/sports/basketball/leagues/nba/events/401705431?lang=en&region=us"
    }
  ]
}