{
  "count": 30,
  "pageIndex": 1,
  "pageSize": 25,
  "pageCount": 2,
  "items": [
    {
      "$ref": "http://sports.core.api.espn.com/v2/sports/baseball/leagues/mlb/seasons/2024/coaches/341?lang=en&region=us"
    },
    {
      "$ref": "http://sports.core.api.espn.com/v2/sports/baseball/leagues/mlb/seasons/2024/coaches/160?lang=en&region=us"
    },
    {
      "$ref": "http://sports.core.api.espn.com/v2/sports/baseball/leagues/mlb/seasons/2024/coaches/55?lang=en&region=us"
    },
    {
      "$ref": "http://sports.core.api.espn.com/v2/sports/baseball/leagues/mlb/seasons/2024/coaches/257?lang=en&region=us"
    },
    {
      "$ref": "http://sports.core.api.espn.com/v2/sports/baseball/leagues/mlb/seasons/2024/coaches/192?lang=en&region=us"
    },
    {
      "$ref": "http://sports.core.api.espn.com/v2/sports/baseball/leagues/mlb/seasons/2024/coaches/86?lang=en&region=us"
    },
    {
      "$ref": "http://sports.core.api.espn.com/v2/sports/baseball/leagues/mlb/seasons/2024/coaches/181?lang=en&region=us"
    },
    {
      "$ref": "http://sports.core.api.espn.com/v2/sports/baseball/leagues/mlb/seasons/2024/coaches/152?lang=en&region=us"
    },
    {
      "$ref": "http://sports.core.api.espn.com/v2/sports/baseball/leagues/mlb/seasons/2024/coaches/170?lang=en&region=us"
    },
    {
      "$ref": "http://sports.core.api.espn.com/v2/sports/baseball/leagues/mlb/seasons/2024/coaches/165?lang=en&region=us"
    },
    {
      "$ref": "http://sports.core.api.espn.com/v2/sports/baseball/leagues/mlb/seasons/2024/coaches/177?lang=en&region=us"
    },
    {
      "$ref": "http://sports.core.api.espn.com/v2/sports/baseball/leagues/mlb/seasons/2024/coaches/247?lang=en&region=us"
    },
    {
      "$ref": "http://sports.core.api.espn.com/v2/sports/baseball/leagues/mlb/seasons/2024/coaches/25?lang=en&region=us"
    },
    {
      "$ref": "http://sports.core.api.espn.com/v2/sports/baseball/leagues/mlb/seasons/2024/coaches/184?lang=en&region=us"
    },
    {
      "$ref": "http://sports.core.api.espn.com/v2/sports/baseball/leagues/mlb/seasons/2024/coaches/157?lang=en&region=us"
    },
    {
      "$ref": "http://sports.core.api.espn.com/v2/sports/baseball/leagues/mlb/seasons/2024/coaches/150?lang=en&region=us"
    },
    {
      "$ref": "http://sports.core.api.espn.com/v2/sports/baseball/leagues/mlb/seasons/2024/coaches/2?lang=en&region=us"
    },
    {
      "$ref": "http://sports.core.api.espn.com/v2/sports/baseball/leagues/mlb/seasons/2024/coaches/194?lang=en&region=us"
    },
    {
      "$ref": "http://sports.core.api.espn.com/v2/sports/baseball/leagues/mlb/seasons/2024/coaches/154?lang=en&region=us"
    },
    {
      "$ref": "http://sports.core.api.espn.com/v2/sports/baseball/leagues/mlb/seasons/2024/coaches/163?lang=en&region=us"
    },
    {
      "$ref": "http://sports.core.api.espn.com/v2/sports/baseball/leagues/mlb/seasons/2024/coaches/193?lang=en&region=us"
    },
    {
      "$ref": "http://sports.core.api.espn.com/v2/sports/baseball/leagues/mlb/seasons/2024/coaches/183?lang=en&region=us"
    },
    {
      "$ref": "http://sports.core.api.espn.com/v2/sports/baseball/leagues/mlb/seasons/2024/coaches/339?lang=en&region=us"
    },
    {
      "$ref": "http://sports.core.api.espn.com/v2/sports/baseball/leagues/mlb/seasons/2024/coaches/178?lang=en&region=us"
    },
    {
      "$ref": "http://sports.core.api.espn.com/v2/sports/baseball/leagues/mlb/seasons/2024/coaches/167?lang=en&region=us"
    }
  ]
}