{"count":55,"pageIndex":1,"pageSize":100,"pageCount":1,"items":[{"$ref":"http://sports.core.api.espn.com/v2/sports/baseball/leagues/mlb/providers/1?lang=en&region=us"},{"$ref":"http://sports.core.api.espn.com/v2/sports/baseball/leagues/mlb/providers/2?lang=en&region=us"},{"$ref":"http://sports.core.api.espn.com/v2/sports/baseball/leagues/mlb/providers/3?lang=en&region=us"},{"$ref":"http://sports.core.api.espn.com/v2/sports/baseball/leagues/mlb/providers/4?lang=en&region=us"},{"$ref":"http://sports.core.api.espn.com/v2/sports/baseball/leagues/mlb/providers/5?lang=en&region=us"},{"$ref":"http://sports.core.api.espn.com/v2/sports/baseball/leagues/mlb/providers/8?lang=en&region=us"},{"$ref":"http://sports.core.api.espn.com/v2/sports/baseball/leagues/mlb/providers/9?lang=en&region=us"},{"$ref":"http://sports.core.api.espn.com/v2/sports/baseball/leagues/mlb/providers/10?lang=en&region=us"},{"$ref":"http://sports.core.api.espn.com/v2/sports/baseball/leagues/mlb/providers/11?lang=en&region=us"},{"$ref":"http://sports.core.api.espn.com/v2/sports/baseball/leagues/mlb/providers/12?lang=en&region=us"},{"$ref":"http://sports.core.api.espn.com/v2/sports/baseball/leagues/mlb/providers/13?lang=en&region=us"},{"$ref":"http://sports.core.api.espn.com/v2/sports/baseball/leagues/mlb/providers/14?lang=en&region=us"},{"$ref":"http://sports.core.api.espn.com/v2/sports/baseball/leagues/mlb/providers/15?lang=en&region=us"},{"$ref":"http://sports.core.api.espn.com/v2/sports/baseball/leagues/mlb/providers/16?lang=en&region=us"},{"$ref":"http://sports.core.api.espn.com/v2/sports/baseball/leagues/mlb/providers/17?lang=en&region=us"},{"$ref":"http://sports.core.api.espn.com/v2/sports/baseball/leagues/mlb/providers/18?lang=en&region=us"},{"$ref":"http://sports.core.api.espn.com/v2/sports/baseball/leagues/mlb/providers/19?lang=en&region=us"},{"$ref":"http://sports.core.api.espn.com/v2/sports/baseball/leagues/mlb/providers/20?lang=en&region=us"},{"$ref":"http://sports.core.api.espn.com/v2/sports/baseball/leagues/mlb/providers/21?lang=en&region=us"},{"$ref":"http://sports.core.api.espn.com/v2/sports/baseball/leagues/mlb/providers/22?lang=en&region=us"},{"$ref":"http://sports.core.api.espn.com/v2/sports/baseball/leagues/mlb/providers/23?lang=en&region=us"},{"$ref":"http://sports.core.api.espn.com/v2/sports/baseball/leagues/mlb/providers/24?lang=en&region=us"},{"$ref":"http://sports.core.api.espn.com/v2/sports/baseball/leagues/mlb/providers/25?lang=en&region=us"},{"$ref":"http://sports.core.api.espn.com/v2/sports/baseball/leagues/mlb/providers/26?lang=en&region=us"},{"$ref":"http://sports.core.api.espn.com/v2/sports/baseball/leagues/mlb/providers/27?lang=en&region=us"},{"$ref":"http://sports.core.api.espn.com/v2/sports/baseball/leagues/mlb/providers/28?lang=en&region=us"},{"$ref":"http://sports.core.api.espn.com/v2/sports/baseball/leagues/mlb/providers/38?lang=en&region=us"},{"$ref":"http://sports.core.api.espn.com/v2/sports/baseball/leagues/mlb/providers/44?lang=en&region=us"},{"$ref":"http://sports.core.api.espn.com/v2/sports/baseball/leagues/mlb/providers/45?lang=en&region=us"},{"$ref":"http://sports.core.api.espn.com/v2/sports/baseball/leagues/mlb/providers/46?lang=en&region=us"},{"$ref":"http://sports.core.api.espn.com/v2/sports/baseball/leagues/mlb/providers/47?lang=en&region=us"},{"$ref":"http://sports.core.api.espn.com/v2/sports/baseball/leagues/mlb/providers/48?lang=en&region=us"},{"$ref":"http://sports.core.api.espn.com/v2/sports/baseball/leagues/mlb/providers/49?lang=en&region=us"},{"$ref":"http://sports.core.api.espn.com/v2/sports/baseball/leagues/mlb/providers/50?lang=en&region=us"},{"$ref":"http://sports.core.api.espn.com/v2/sports/baseball/leagues/mlb/providers/51?lang=en&region=us"},{"$ref":"http://sports.core.api.espn.com/v2/sports/baseball/leagues/mlb/providers/52?lang=en&region=us"},{"$ref":"http://sports.core.api.espn.com/v2/sports/baseball/leagues/mlb/providers/53?lang=en&region=us"},{"$ref":"http://sports.core.api.espn.com/v2/sports/baseball/leagues/mlb/providers/54?lang=en&region=us"},{"$ref":"http://sports.core.api.espn.com/v2/sports/baseball/leagues/mlb/providers/55?lang=en&region=us"},{"$ref":"http://sports.core.api.espn.com/v2/sports/baseball/leagues/mlb/providers/56?lang=en&region=us"},{"$ref":"http://sports.core.api.espn.com/v2/sports/baseball/leagues/mlb/providers/58?lang=en&region=us"},{"$ref":"http://sports.core.api.espn.com/v2/sports/baseball/leagues/mlb/providers/59?lang=en&region=us"},{"$ref":"http://sports.core.api.espn.com/v2/sports/baseball/leagues/mlb/providers/1001?lang=en&region=us"},{"$ref":"http://sports.core.api.espn.com/v2/sports/baseball/leagues/mlb/providers/1002?lang=en&region=us"},{"$ref":"http://sports.core.api.espn.com/v2/sports/baseball/leagues/mlb/providers/1003?lang=en&region=us"},{"$ref":"http://sports.core.api.espn.com/v2/sports/baseball/leagues/mlb/providers/1004?lang=en&region=us"},{"$ref":"http://sports.core.api.espn.com/v2/sports/baseball/leagues/mlb/providers/1005?lang=en&region=us"},{"$ref":"http://sports.core.api.espn.com/v2/sports/baseball/leagues/mlb/providers/1006?lang=en&region=us"},{"$ref":"http://sports.core.api.espn.com/v2/sports/baseball/leagues/mlb/providers/1007?lang=en&region=us"},{"$ref":"http://sports.core.api.espn.com/v2/sports/baseball/leagues/mlb/providers/1008?lang=en&region=us"},{"$ref":"http://sports.core.api.espn.com/v2/sports/baseball/leagues/mlb/providers/1009?lang=en&region=us"},{"$ref":"http://sports.core.api.espn.com/v2/sports/baseball/leagues/mlb/providers/1010?lang=en&region=us"},{"$ref":"http://sports.core.api.espn.com/v2/sports/baseball/leagues/mlb/providers/2382?lang=en&region=us"},{"$ref":"http://sports.core.api.espn.com/v2/sports/baseball/leagues/mlb/providers/4000?lang=en&region=us"},{"$ref":"http://sports.core.api.espn.com/v2/sports/baseball/leagues/mlb/providers/7874?lang=en&region=us"}]}