{"count":74,"pageIndex":1,"pageSize":10,"pageCount":8,"items":[{"$ref":"http://sports.core.api.espn.com/v2/sports/football/leagues/nfl/positions/0?lang=en&region=us"},{"$ref":"http://sports.core.api.espn.com/v2/sports/football/leagues/nfl/positions/1?lang=en&region=us"},{"$ref":"http://sports.core.api.espn.com/v2/sports/football/leagues/nfl/positions/2?lang=en&region=us"},{"$ref":"http://sports.core.api.espn.com/v2/sports/football/leagues/nfl/positions/3?lang=en&region=us"},{"$ref":"http://sports.core.api.espn.com/v2/sports/football/leagues/nfl/positions/4?lang=en&region=us"},{"$ref":"http://sports.core.api.espn.com/v2/sports/football/leagues/nfl/positions/5?lang=en&region=us"},{"$ref":"http://sports.core.api.espn.com/v2/sports/football/leagues/nfl/positions/6?lang=en&region=us"},{"$ref":"http://sports.core.api.espn.com/v2/sports/football/leagues/nfl/positions/7?lang=en&region=us"},{"$ref":"http://sports.core.api.espn.com/v2/sports/football/leagues/nfl/positions/8?lang=en&region=us"},{"$ref":"http://sports.core.api.espn.com/v2/sports/football/leagues/nfl/positions/9?lang=en&region=us"}]}