{
  "count": 11500,
  "pageIndex": 1,
  "pageSize": 25,
  "pageCount": 460,
  "items": [
    {
      "$ref": "http://sports.core.api.espn.com/v2/sports/hockey/leagues/nhl/athletes/1?lang=en&region=us"
    },
    {
      "$ref": "http://sports.core.api.espn.com/v2/sports/hockey/leagues/nhl/athletes/2?lang=en&region=us"
    },
    {
      "$ref": "http://sports.core.api.espn.com/v2/sports/hockey/leagues/nhl/athletes/3?lang=en&region=us"
    },
    {
      "$ref": "http://sports.core.api.espn.com/v2/sports/hockey/leagues/nhl/athletes/4?lang=en&region=us"
    },
    {
      "$ref": "http://sports.core.api.espn.com/v2/sports/hockey/leagues/nhl/athletes/5?lang=en&region=us"
    },
    {
      "$ref": "http://sports.core.api.espn.com/v2/sports/hockey/leagues/nhl/athletes/6?lang=en&region=us"
    },
    {
      "$ref": "http://sports.core.api.espn.com/v2/sports/hockey/leagues/nhl/athletes/7?lang=en&region=us"
    },
    {
      "$ref": "http://sports.core.api.espn.com/v2/sports/hockey/leagues/nhl/athletes/8?lang=en&region=us"
    },
    {
      "$ref": "http://sports.core.api.espn.com/v2/sports/hockey/leagues/nhl/athletes/9?lang=en&region=us"
    },
    {
      "$ref": "http://sports.core.api.espn.com/v2/sports/hockey/leagues/nhl/athletes/10?lang=en&region=us"
    },
    {
      "$ref": "http://sports.core.api.espn.com/v2/sports/hockey/leagues/nhl/athletes/11?lang=en&region=us"
    },
    {
      "$ref": "http://sports.core.api.espn.com/v2/sports/hockey/leagues/nhl/athletes/12?lang=en&region=us"
    },
    {
      "$ref": "http://sports.core.api.espn.com/v2/sports/hockey/leagues/nhl/athletes/13?lang=en&region=us"
    },
    {
      "$ref": "http://sports.core.api.espn.com/v2/sports/hockey/leagues/nhl/athletes/14?lang=en&region=us"
    },
    {
      "$ref": "http://sports.core.api.espn.com/v2/sports/hockey/leagues/nhl/athletes/15?lang=en&region=us"
    },
    {
      "$ref": "http://sports.core.api.espn.com/v2/sports/hockey/leagues/nhl/athletes/16?lang=en&region=us"
    },
    {
      "$ref": "http://sports.core.api.espn.com/v2/sports/hockey/leagues/nhl/athletes/17?lang=en&region=us"
    },
    {
      "$ref": "http://sports.core.api.espn.com/v2/sports/hockey/leagues/nhl/athletes/18?lang=en&region=us"
    },
    {
      "$ref": "http://sports.core.api.espn.com/v2/sports/hockey/leagues/nhl/athletes/19?lang=en&region=us"
    },
    {
      "$ref": "http://sports.core.api.espn.com/v2/sports/hockey/leagues/nhl/athletes/20?lang=en&region=us"
    },
    {
      "$ref": "http://sports.core.api.espn.com/v2/sports/hockey/leagues/nhl/athletes/21?lang=en&region=us"
    },
    {
      "$ref": "http://sports.core.api.espn.com/v2/sports/hockey/leagues/nhl/athletes/22?lang=en&region=us"
    },
    {
      "$ref": "http://sports.core.api.espn.com/v2/sports/hockey/leagues/nhl/athletes/23?lang=en&region=us"
    },
    {
      "$ref": "http://sports.core.api.espn.com/v2/sports/hockey/leagues/nhl/athletes/24?lang=en&region=us"
    },
    {
      "$ref": "http://sports.core.api.espn.com/v2/sports/hockey/leagues/nhl/athletes/25?lang=en&region=us"
    }
  ]
}